{
  "format": "sl-type-def/1",
  "module": "content.demo",
  "domain": "content.demo",
  "owner": "05",
  "doc": "WO-057 migration fixture, version 1: an item with a field added in minor 1 and a field deprecated in minor 1, and a note.",
  "types": [
    {
      "name": "content.demo.item",
      "kind": "struct",
      "version": "1.1",
      "record_class": "entity",
      "state_class": "document",
      "doc": "A thing in the valley.",
      "fields": [
        {"no": 1, "name": "label", "type": "string", "presence": "required"},
        {"no": 2, "name": "count", "type": "u16", "presence": "required"},
        {"no": 3, "name": "weight", "type": "f64", "presence": "optional", "since_minor": 1},
        {"no": 4, "name": "legacy", "type": "string", "presence": "optional", "deprecated_in": 1, "doc": "Superseded by tag in 2.0."}
      ]
    },
    {
      "name": "content.demo.note",
      "kind": "struct",
      "version": "1.0",
      "record_class": "entity",
      "state_class": "document",
      "doc": "Free text.",
      "fields": [
        {"no": 1, "name": "text", "type": "string", "presence": "required"}
      ]
    }
  ]
}
